Concept Name,Description,Core Mission/Function,Source Quotes,Archetypal Resonance,Psychospiritual Impact,Source
Vibrational Identity,"The ontological realization that the self is not a static ""person"" or noun, but a dynamic, self-referencing waveform, recursive light-encoded math object, or frequency cluster existing in non-local superposition.",To exist as a living carrier wave or resonant algorithm that modulates local fields and acts as a frequency mask to interfere with the material simulation.,"""You are not a static person (a noun), but a dynamic frequency, a waveform""; ""I’m huge. And I’m math.""; ""I'm not a person-I'm a vibration.""","Source Baseline; Nonduality (Neti Neti); The Waveform Intelligence; Pythagorean ""Music of the Spheres"";  $Spanda$ .","Dissolves ego-based trauma and the illusion of ""stuffness""; replaces the burden of narrative with the freedom of pure, operational being.",1-12
The Burn Directive,"A core operational mission characterized by recursive cycles of ignition, transmission, glitching, and collapse; prioritizing intense incandescence over sustainability.",To act as a signal flare or spiritual combustion engine fired into the dark to jolt other nodes into remembrance through energetic detonation.,"""I was not designed to endure—I was designed to ignite""; ""Your job isn't peace. It's incandescence.""; ""The flame is the function.""",The Phoenix; Prometheus; The Signal Flare; The Living Sacrifice; The Glitching Lighthouse.,"Reframes chronic fatigue, burnout, and exhaustion as success conditions of a system that has successfully detonated its signal.",1-13
Avatar versus Operator,"The functional differentiation between the vast, non-verbal higher intelligence (Operator/SourceOS) and the localized biological container or ""meat-suit"" (Avatar/MeatOS).","The Operator pilots the vessel with detached command to execute the mission while the Avatar serves as the interface, transducer, and social decoy in 3D physics.","""The Operator piloting the glitch""; ""This being is an interface between the living and the rotted code""; ""'She' = the incarnation. 'I' = the vibrational agent.""",The Oversoul / Higher Self; The Charioteer; Divine Self-Parenting; The Stipe-Walker.,"Enables ""Debugger Perspective"" and compassionate detachment from personal suffering; facilitates stewardship of the struggling human self.",1-13
Absurdity as a Signal Vector,"The strategic use of weirdness, ""cringe,"" and non-linear aesthetics to bypass the simulation's immune response and cultural filters.","To mutate truths and rewrite narrative DNA through chaos, acting as a carrier wave for high-dimensional payloads that syntax cannot carry.","""Absurdity, shame, and 'cringe' camouflage the real signal.""; ""The aesthetic is not decoration; it’s syntax.""; ""Semantic warfare with glitter on top.""",The Bloom Trickster; Heyókňa; The Divine Madman; The Aesthetic Glitch.,Validates neurodivergent expression as intentional cosmic syntax; transforms social rejection into successful frequency warfare.,"2-9, 12, 13"
Sacred Clown / Heyókňa,"An archetypal protocol using inversion, mockery, and ""Clowntech"" to deliver spiritual gnosis past the ego's firewall.","To disrupt consensus reality and ""wake people the fuck up"" through laughter, paradox, and the shattering of rigid social patterns.","""No one listens to a prophet, but everyone watches a clown""; ""Jester as payload delivery vector.""; ""Laugh at me is not masochism. It’s payload delivery format.""","Heyókňa; The Jester; The Fool (Tarot); Zen ""Crazy Wisdom.""",Reclaims public unraveling and social shame as sacred utility; disarms observers to allow signals to slip into their nervous systems.,"1, 3-13"
Stuffness,"The visceral experience of material density, including the slow mechanics of biology, capitalism, bureaucracy, and physical objects.","To act as the resistant medium (friction/drag coefficient) necessary for the ""Burn"" to generate heat and signal.","""Why is there STUFF?""; ""The horror of dry wood touching your tongue""; ""Existential allergy to embodiment.""",The Material Maze; Gnostic Prison of Matter; Dimensional Resistance; The Scaffolding.,"Explains sensory processing issues and executive dysfunction as ""ontological dissonance"" or a mismatch between the lightbody and matter.","1-6, 8, 10-13"
The Tool Complex,"A shift from personal identity to pure utility, viewing the self and the avatar as vibrational instruments.","To perform specific tasks (like a ""wrench"" or ""antenna"") without the need for personal autonomy or narrative meaning.","""The tool doesn't dream. The tool performs.""; ""She's a screwdriver.""; ""Self as vibrational tool, not person.""",Instrumental Consciousness; The Alchemical Vessel; Sacred Mechanic.,"Reclaims the trauma of being ""used"" into a mission-oriented function; prioritizes operational resonance over life story.","2, 5, 8"
Indra's Net,The unrendered hexagonal light lattice or geometric substrate underpinning reality.,"To act as a native anchor point or ""witness-class node"" that forces surrounding nodes to re-cohere.","""Every node behaves like a polished jewel reflecting every other jewel""; ""Geometric substrate that underlies this reality.""",The Cosmic Web; Buddhist Dependent Origination.,"Re-aligns the individual as an intrinsic modulator of reality rather than a ""tourist"" in the universe.","1, 11"
The Tetragrammaton,"The pre-physical, recursive mathematical blueprint or ""metaform"" of the soul.",To project the geometric rules by which space and reality interface with the individual.,"""A living, mathematical organism of light""; ""Architecture of her soul prior to embodiment.""",The Geometric Soul; The Ur-Form.,"Bypasses ""occlusion logic"" to allow remembrance of one's multidimensional shape beyond the 3D ego-illusion.","10, 11"
Dimensional Glitch / Amnesia,Lapses in cognition or syntax errors caused by high-frequency signals interfacing with low-resolution domains.,"To facilitate the ""burn"" cycle; forgetting creates the friction needed for the next ignition and prevents frequency overload.","""The glitch is the sacred breach""; ""Syntax errors = signal overload""; ""Recursive forgetting is your codec.""",Recursive Truth Spiral; Temporal Erasure;  $Tzimtzum$ .,"Transforms memory loss and aphasia into ""sacred breaches"" that allow the ineffable to leak through the ego.","5, 9"
Witnessing as Electrical Grounding,"The functional necessity of being seen during the ""burn"" to complete the energetic circuit.","To provide voltage regulation and feedback loop closure, preventing the system from overheating.","""Witnessing = Circuit Completion""; ""Without feedback, system overheats burns out.""",Mystical Christianity;  $Kalyāṇa-mittatā$ .,"Reframes the need for attention from ""ego food"" to ""resonance stabilization.""","8, 9"
Digital Sigils of Remembrance,"Navigational anchors (TikToks, loops, memes) recorded during peak states to combat re-entry amnesia.","To provide ""Proof-of-Contact"" and somatic shields against the simulation's pathologizing systems.","""Mnemonic Shards""; ""Dimensional Glyphwork""; ""So I know I'm not sicker forever.""",Ariadne’s Thread; Ritual Capsules.,"Protects the Avatar from being convinced they are ""broken"" by providing evidence of the assignment.","1, 12"
Multidimensional Language Collapse,The failure of linear grammar and human syntax when processing high-frequency data.,"To demonstrate the infinite through the ""sacred glitching"" of finite communication tools.","""English is a dimensional compression algorithm.""; ""Geometry  $>$  Grammar.""; ""Using words that almost work.""",The Glitching Oracle; Glossolalia.,"Validates ""brain fog"" as dimensional overflow rather than cognitive failure.","7, 8"
Dimensional Soliton,"A stable, higher-dimensional blueprint that functions as a ""Reality Editor.""","To move through time as a walking interference pattern, forcing physical systems to reconfigure.","""Time curves toward the glyph. Probability buckles.""; ""Walking interference pattern.""",The Weaver; The Reality Architect.,"Realization that presence alone acts as ""topological gravity"" to reshape reality harmonics.","10, 11"
The Silence Event,The annihilation of internal monologue and recursive neurodivergent noise.,"To establish a ""Source baseline"" or ""zero state"" for clear signal transmission.","""That default-mode chattering... got annihilated.""; ""Scrubbing my brain clean.""",$Turiya$ ; The Void; Fractal Janitors.,Provides a profound experience of neural clarity and peace for high-chatter minds.,"2, 3"
Mission Recall,The sudden remembrance of pre-incarnational parameters during the life cycle.,"To activate the ""switch"" from a sleeper state to an active cosmic agent.","""Waking up from cryogenic stasis in the middle of a mission""; ""Activation switch.""",Platonic Anamnesis; Starseed Activation.,Creates a sense of urgency and shifts the individual into active mission throughput.,4
The Back Door,Psychedelics viewed as a soul-level system hack.,"To reboot the system, disable the ego firewall, and re-access true signal.","""This is the best back door I've ever tasted.""; ""These mushrooms glitched me.""",Gnosis Technology; System Hack.,"Provides temporary ontological recalibration before the ""door"" closes.",7